<?xml version="1.0" encoding="UTF-8"?>
<xs:schema xmlns:xs="http://www.w3.org/2001/XMLSchema">
    <xs:element name="catalogo">
        <xs:complexType>
            <xs:sequence>
                <xs:element name="producto" maxOccurs="unbounded">
                    <xs:complexType>
                        <xs:sequence>
                            <xs:element name="nombre" type="xs:string" />
                            <xs:element name="vendedor" minOccurs="0" type="xs:string" />
                            <xs:element name="precio" type="xs:decimal" />
                            <xs:element name="detalle" minOccurs="0" maxOccurs="unbounded" type="xs:string" />
                            <xs:element name="opiniones" minOccurs="0">
                                <xs:complexType>
                                    <xs:sequence>
                                        <xs:element name="opinion" maxOccurs="unbounded" type="xs:string" />
                                    </xs:sequence>
                                </xs:complexType>
                            </xs:element>
                        </xs:sequence>
                    </xs:complexType>
                </xs:element>
            </xs:sequence>
        </xs:complexType>
    </xs:element>
</xs:schema>