<?xml version="1.0" encoding="UTF-8"?>
<catalogo xmlns:xsi="http://www.w3.org/2001/XMLSchema-instance" xsi:noNamespaceSchemaLocation="e04.xsd">
    <producto>
        <nombre>Teclado inal√°mbrico Zeus 23Q</nombre>
        <vendedor>Todo Teclados</vendedor>
        <precio>23.90</precio>
        <detalle>Opera en la frecuencia de 2.4 GHz</detalle>
        <detalle>Hasta 20 metros de distancia</detalle>
    </producto>
    <producto>
        <nombre>Smartwatch Pulserita Wear</nombre>
        <precio>120.90</precio>
        <opiniones>
            <opinion>Mi abuela me toma mejor el pulso</opinion>
            <opinion>No es resistente al agua</opinion>
        </opiniones>
    </producto>
</catalogo>